1,联想,品牌,危机,好客山东 全新区域品牌模式的样本和地标,——2009中国区域品牌传播论坛暨“好客山东”旅游品牌与价值推广会议专家发言摘要,编者按:    2007年，山东省旅游局依据山东地域文化特征，同时注重亲情化、体验化、个性化，充分体现旅游业的“以人为本”特征，创意提出了“好客山东”区域旅游品牌，使其成为山东旅游品牌的文化标识，又将其打造成山东现代高品质旅游品牌的标志。    短短两年时,2009-09-07,好客山东,019,F592.7,中国旅游报,北京市,北京市建国门内大街甲9号100740,中央级,http://www.ctnews.com.cn,郑兵兵,李太光,
2,联想,品牌,危机,国际金融危机下的中国知识产权战略实施,,阅读提示    去年以来，国际金融危机爆发，世界贸易组织的统计数据显示，2008年金融危机导致世界贸易增速下降至4%，世界经济面临着严峻考验，我国知识产权战略的实施也同样面临着一个新的、更为复杂的国际背景。权威专家指出，我国必须充分认识当前形势的“危”与“机?,2009-05-15,理论·视点,004,F204,中国知识产权报,北京市,北京市海淀区蓟门桥西土城路6号100088,中央级,http://www.cipnews.com.cn/,吴汉东,,
3,联想,品牌,危机,与时俱进  以“工匠精神”建设企业品牌,品牌建设与传播系列调查·江苏之对策篇(下),要使江苏品牌迈向中高端，跻身国际先进水平，除了发挥政府职能部门引导、推动等作用，营造有利于品牌做大做强的政策环境和市场环境之外，企业与社会等在促进和提升品牌建设质量、品牌竞争力及影响力方面也应与时俱进，聚力创新，不懈努力。近日，中国经济时报记者在江苏南京?,2017-04-14,,001,F273.2,中国经济时报,北京市,北京市昌平区平西府王府街102209,中央级,http://www.cet.com.cn/,王晶晶,张娜,
4,联想,品牌,危机,联想6年来首亏  收购摩托罗拉很痛苦,,近日，联想集团发布了2015年财报，财报显示，2015财年联想净亏损1.28亿美元，这是联想自金融危机后6年来的首次亏损。联想方面坦言，上一财年的亏损主要和个人电脑（PC）市场的疲软，以及整合摩托罗拉手机业务的成本有关。联想的管理层也承认，低估了整合摩托罗拉移动业务的困,2016-06-07,商界·企业,P06,F426.671,中国商报,北京市,北京市宣武区报国寺1号100053,中央级,http://www.zgswcn.com/,房雅楠,,
5,联想,品牌,危机,从双汇瘦肉精和锦湖轮胎事件看危机公关,,危机公关的特点决定了，其是不期而遇的，是突发的，伤害性大。    优势品牌也难免遭遇危机，因此，如何通过科学的危机分析，做到准确的事前、事中、事后的关键点控制，是企业日常管理的必修课。    本文拟利用作者独创的危机管理的HACCP理论和模型，通过解剖今年3?,2011-04-06,营销管理,007,F272,中国食品报,北京市,北京市丰台区太平桥东里5号楼100073,中央级,http://www.cnfood.cn/,董国用,,
6,联想,品牌,危机,中航工业第一期国际化企业品牌战略培训总结,,为贯彻落实国家关于“推动自主品牌建设，提升品牌价值和效应，加快发展拥有国际知名品牌和国际竞争力的大型企业”的要求，积极推动集团公司战略落地，加快品牌体系建设，提升品牌工作团队的业务水平和工作能力，学习借鉴国际企业品牌建设经验，2013年9月10~30日，集团公司战?,2013-12-05,专题,004,F273.2;F426.5,中国航空报,北京市,北京市东城区美术馆后街亮果厂5号100010,中央级,http://www.cannews.com.cn/,费洪柱,王京梅,宋可为
7,联想,品牌,危机,国有企业如何进行品牌建设,,发展和壮大国有企业是坚持社会主义基本经济制度、建设社会主义和谐社会的本质要求。近年来，国有企业在“做大”上成绩斐然，有目共睹。根据2014年《财富》公布的世界500强榜单，中国入选企业数量达到100家，其中47家为国务院国资委监管的中央企业，中国石油、中国石化与国家?,2015-12-08,重塑形象专刊 理论研究,004,F276.1;F273.2,中国石油报,北京市,北京市朝阳区外安华里二区甲3号100724,中央级,http://www.cnpc.com.cn/,曹奇,曹定爱,
8,联想,品牌,危机,联想巨亏VS华为称王：中国企业两条不同的跨国经营之路,,近年来华为蒸蒸日上，越来越强大，而联想明显后劲不足，包袱日见沉重；一个不断向上腾飞，一个盈利都相当艰难……其更重要的差别是中国优秀企业如何走向世界战略道路的选择不同。在2015年结束的时候，中国两家标志性的制造企业——华为与联想高下已分，一家已经称王世界,2016-01-12,企业新闻,011,F426.6,企业家日报,四川省,四川省成都市二环路西二段12号610072,地方级,http://www.chinacaixin.com/,张庭宾,,
9,联想,品牌,危机,联想：战略迷失的巨头？,,“赌上身家性命押注AI”，杨元庆治下的联想，又一次站在转型的路口。“三年之内我们要投入12亿美元，确保我们由人工智能驱动的基础设施+云、设备+云业务保持足够的后劲，确保联想成为人工智能时代领先的企业。”7月20日，联想集团董事长兼CEO杨元庆在Tech World 2017现?,2017-07-24,智在公司,C01,F426.67,中国经营报,北京市,北京市海淀区西四环北路6号院1号楼100089,中央级,http://www.cb.com.cn/,马秀岚,李正豪,
10,联想,品牌,危机,区域品牌的内涵及其价值,,"转变经济发展方式,在发展中促转变,在转变中求发展,是此次中央经济工作会议的重要精神之一。就区域经济发展而言,发展低污染企业,发展低碳经济、绿色经济是转变发展方式的一种路径,而打造区域品牌,确立“大产业、大园区、大品牌”的发展理念,占领区域特色的价值高地,实现区域品",2010-01-12,理论周刊,010,F120;F273.2,光明日报,北京市,北京市东城区珠市口东大街5号100062,中央级,http://www.gmw.cn/,陈栋,,
11,联想,品牌,危机,讲好品牌故事，要沉淀也要创新,谢京辉在首届中国品牌经济(上海)论坛上的演讲,任何物化的背后一定是文化的支撑，中国元素在于文化基因，这种基因源于价值观的植入。品牌的核心就是放大产品的这种价值，中国品牌有别于其他品牌在于其差异化，注入中国文化的核心是其根本  对于中国来说，通过技术创新，实现“弯道超车”，是迅速形成自己品牌的一?,2015-06-20,思想者,005,F273.2,解放日报,上海市,上海市汉口路300号200001,地方级,http://www.jfdaily.com/,,,
12,联想,品牌,危机,品牌决定竞争力,——访品牌竞争力大师李光斗,“希望珠海企业家能以品牌战略，创造更多像海尔、蒙牛、联想一样的领先企业。”前日，中央电视台品牌顾问、有中国十大策划人之称的李光斗在北京接受珠海媒体采访时，就营销战略与品牌建设向珠海的企业家献计。     记者：在产品高度同质化的年代，为什么“情感”能够催,2008-06-16,城市周刊·专题,013,F273.2,珠海特区报,广东省,广东省珠海市香洲银桦路566号519000,地方级,http://www.hizh.cn/,本版编辑李光斗  马巍,,
13,联想,品牌,危机,制造企业转型“品牌”公司  宏碁的国际化路径,,时隔三年，2008年4月，宏碁全球总裁、意大利人兰奇再次来到中国督战，促成此次访问的原因是，“2008年是宏碁在中国市场奋进的一年”。去年一年，宏碁通过并购完成了在北美及欧洲市场的布局，下一步的重心无疑是中国。“华语”企业中国际化成功的案例不多，宏碁是其中之一。他,2008-05-12,,B08,F426.6,中国经营报,北京市,北京市海淀区西四环北路6号院1号楼100089,中央级,http://www.cb.com.cn/,侯雪莲,,
14,联想,品牌,危机,“林疯狂”正常了  企业该怎么办？,,伤痛、违规、骗局、性丑闻……对于大多数光芒四射、万众瞩目的文体明星来说，类似的危机事件可说时有发生，特别对一些国际大品牌的代言明星来说，各种突发的负面八卦无异于家常便饭，而近期媒体追逐最为频繁且引发舆情最为反复的有林书豪因伤停赛、韩寒代笔门事件等。,2012-05-16,财富 案例,A16,F273.2,南方日报,广东省,广东省广州市广州大道289号510601,地方级,http://www.southcn.com/,冯善书,柯倩杏,
15,联想,品牌,危机,财富标志缺失是当前经济危机的总根源,,编者按：本文是作者2010年12月12日为中航工业所属成员单位新任领导任职培训班授课时的讲义。作者认为，在广义虚拟经济时代，物质“极大丰富”之后最关键的稀缺是财富标志的缺失。生活对象化创造的虚拟价值进入交换领域，使得物本经济时代“人际隐性金融交易”中的潜在财富显?,2011-01-13,专题,002,F426.5,中国航空报,北京市,北京市东城区美术馆后街亮果厂5号100010,中央级,http://www.cannews.com.cn/,林左鸣,,
16,联想,品牌,危机,建立均衡有效的危机管理机制,——丰田汽车召回事件思考(上),“首先清楚地说明你并不了解全部情况，然后迅速将你知道的说出去。你一定要懂得，问题不会因为时间的推移而自行得到改善。”这是沃伦·巴菲特对企业处理危机的忠告。丰田汽车召回事件再次表明，当企业面临危机时，搪塞、躲避和模棱两可的言行，只能使危机扩大。　　丰田，?,2010-03-03,国际,023,F416.471;F431.3,人民日报,北京市,北京市朝阳区金台西路2号100733,中央级,http://www.people.com.cn/,管克江,于青,陈利
17,联想,品牌,危机,新引擎  新机遇,,经济观察报 报道组    中国经济增速趋缓，向常态回归。    去年12月召开的中央经济工作会议，为今后经济发展定调，继续“稳中求进”。在此背景下，中国主流企业的领军者们在较为乐观的预期中，审慎地开启新一轮的增长周期。以“稳”为主，加快转型，加大创新，重视人才，,2013-02-18,公司,025,F124,经济观察报,山东省,山东省济南市趵突泉北路20号250011,地方级,http://www.eeo.com.cn/,,,
18,联想,品牌,危机,国产手机如何实现“逆袭”？,,进入2015年，智能手机厂商的争夺进入了更为残酷的阶段，国产手机与苹果、三星之间，国产手机之间，苹果与三星之间，一时间硝烟弥漫。2015年，对于手机厂商来说，挑战将越来越大，尤其是众多国产品牌，纷纷发力中高端市场，以期摆脱以往依靠低价、性价比获取市场的模式。,2015-01-28,产经新闻·行业观察,007,F416.63,工人日报,北京市,北京市东城区安德路甲61号100718,中央级,http://www.workercn.cn/,孙喜保,,
19,联想,品牌,危机,扩大内需  品牌强国,——论实施品牌战略的重大意义,品牌经济已渗透到企业、产业和城市建设的各个领域，知名品牌的数量已成为衡量一个国家经济实力的标志性符号。因此，党中央和国务院提出要品牌强国的思想，“十二五”规划中，品牌作为关键词出现10次，十八大再次强调形成以技术、品牌为核心的竞争新优势，品牌战略已经上升至?,2017-04-06,质检论坛,004,F273.2;F279.2,中国质量报,北京市,北京市朝阳区育慧南路3号100029,中央级,http://www.cqn.com.cn/,荣宏庆,李海鹏,
20,联想,品牌,危机,"联想VS宏碁,狭路再战",,今年4月14日，《商业周刊》杂志亚洲区编辑布鲁斯·埃因霍恩在《商业周刊》主页上撰写了一篇有关联想与宏碁竞争的博客，通过一些数字和事件暗示联想已经败北。问题是联想真的失败了吗？宏碁真的胜利了吗？回答这个问题前，还是先了解一下这两家企业的来龙去脉吧。　　　　宏,2009-09-19,产业·消费,B02,F426.6,中国经济导报,北京市,北京市宣武区广安门内大街315号信息大厦B座100053,中央级,http://www.ceh.com.cn/,黄林,,
21,联想,品牌,危机,联想手机业务真的不要“联想”了？,,与近日高调发布手机新品的锤子和360不同，联想则悄悄地扔出一颗“炸雷”。    8月26日，有媒体爆出“联想移动将逐步并入摩托罗拉”的消息，一时间，坊间充斥着“世间再无联想手机”的标题。尽管联想移动业务集团总裁陈旭东在27日凌晨第一时间在微博上做出回应，但从措辞来?,2015-08-28,,001,F426.63,中国电子报,北京市,北京市海淀区紫竹院路66号赛迪大厦8层100044,中央级,http://www.cena.com.cn/,张轶群,刘珈延,
22,联想,品牌,危机,FIFA赞助：品牌提高“命中率”的套路,,编者按/举世瞩目的世界杯足球赛已经进入倒计时400天，意在世界杯期间有所收获的厂商也有了新的动作，三月，国际足球联盟(以下简称“FIFA”)宣布万达集团成为未来4届世界杯的主要赞助商。而在4月6日，FIFA又和海信集团在北京共同宣布，海信成为了2018年FIFA世界杯官方赞助商。,2017-05-22,商业案例,C07,G843,中国经营报,北京市,北京市海淀区西四环北路6号院1号楼100089,中央级,http://www.cb.com.cn/,孙聪颖,,
23,联想,品牌,危机,本土品牌：全球竞争中的创新突围,,曾几何时，以上海牌手表、永久牌自行车、蝴蝶牌缝纫机为代表的“老三件”，成为人们评判家庭日常生活水平高低的标准，甚至成为婚嫁聘礼的“标配”。但伴随国际大牌的不断入驻、产品需求的持续脱节，这些国人一度引以为傲的本土品牌，渐呈没落之势。    近年来，借力产品创?,2013-07-28,经济观察·管理|商道,006,F273.2,文汇报,上海市,上海市威海路755号200041,地方级,http://www.jfdaily.com/,傅盛裕,,
24,联想,品牌,危机,职场压力管理:企业应对金融危机的良方,——访北京青年压力管理服务中心主任熊汉忠博士,"在全球金融危机向中国袭来的时候，“压力”已越发成为职业人士尤其是企业家们所无法回避的一个重大现实问题。如何有效预防、应对与缓解因金融危机所带来的种种压力,人们都在尽力地寻找灵丹妙药。　　　　一个偶然的机会，笔者结识了北京青年压力管理服务中心主任、心理学博",2009-03-05,两会关注,016,F272,中国企业报,北京市,北京市海淀区紫竹院南路17号100044,中央级,http://www.zqcn.com.cn/,刘建华,,
25,联想,品牌,危机,中国企业海外并购冲动,,$F策划人语$E$T走出去    义无反顾    当前，中国国有企业正掀起新一轮海外并购热潮。    无论是收购IBM PC业务的联想集团，还是收购美国优尼科的中海油等，走出去都已是义无反顾。    根据权威部门的预测，未来四年内，中?,2005-02-04,特别报道,014,BH4,中国证券报,北京市,北京市西城区宣武门西大街甲97号100031,中央级,http://www.cs.com.cn/,,,
26,联想,品牌,危机,联想手机重组：急需爆款产品,,在全球智能手机增速大幅放缓的市场环境下，联想集团董事长兼CEO杨元庆从去年开始被频繁问及的一个问题是：联想手机如何打一场翻身仗?在这一年中，联想的移动业务经历了频繁的组织架构调整以及业绩下滑危机。此前的联想第三季度财报显示，移动业务上季度销售收入同比减少,2017-03-09,大公司,A07,F426.63,第一财经日报,上海市,上海市康定路211号艺海大厦14楼200041,地方级,http://www.yicai.com/,李娜,,
27,联想,品牌,危机,全球制造业复兴下的中国抉择,利用国际合作创造捷径  通过“一带一路”推广中国品牌,在中国经济进入新常态的背景下，中国制造开始努力转型升级，已经有越来越多的中国制造企业，将视野瞄准了全球市场。随着“一带一路”战略、中国制造2025战略的提出和实施，中国制造业品牌，迎来了“走出去”的最好时机。抓紧提升“中国制造”含金量改革开放以来，?,2015-12-21,视野,006,F424;F125,经济参考报,北京市,北京市西城区百万庄大街24号100803,中央级,http://www.jjckb.cn/,侯云龙,闫磊,
28,联想,品牌,危机,遭遇水危机  康师傅如何当“师傅”？,,康师傅“水源门事件”不但令消费者质疑其产品定位和宣传，同时也引发业内对矿物质水的高度关注和深度探讨。有业内人士表示，矿物质水长期饮用对人体健康有害。对于康师傅来说，这个称霸国内饮品业的龙头老大，正在经历着一次品牌诚信危机的考验。从康师傅“水源”事件?,2008-09-07,商学院,A06,F426.82,证券日报,北京市,北京市西城区裕民东路3号京版信息港三层100054,中央级,http://www.ccstock.cn/,本版编辑李滨良  闵昱,,
29,联想,品牌,危机,联想的冬天,,"近期，联想集团“杨元庆下课、柳传志复出”的传言在业界被吵得沸沸扬扬，对于杨元庆可能下课的理由,各方猜测较多。　　　　2008年12月24日，联想集团官方发出声明，明确否认杨元庆将离职传言。　　　　随着金融危机的突袭，联想三季报业绩下滑 “寒冬”来临，然而联想的?",2008-12-30,公司调查,C01,F426.6,证券日报,北京市,北京市西城区裕民东路3号京版信息港三层100054,中央级,http://www.ccstock.cn/,本报记者  贾丽,,
30,联想,品牌,危机,体育营销：中国品牌刚上路,,编者按：做国际名牌，这是中国企业的梦想。但是，怎样提高品牌的国际知名度，却是横在众多中国企业面前的一道大难题！打造名牌，从企业内部来说，有产品开发、企业管理、提高质量以及市场营销等一系列工作要做，从企业外部看，能不能选择适当的平台展示品牌形象，也是一门大?,2006-12-18,品牌时代,015,G80-05;F713.50,人民日报,北京市,北京市朝阳区金台西路2号100733,中央级,http://www.people.com.cn/,王炜,,
31,联想,品牌,危机,共商发展引擎 驱动经济腾飞,,综述    在去年首届论坛成功举办的基础上，2009“浦江创新论坛”于10月24-25日在上海降重举行。“浦江创新论坛”是国家科技部和上海市人民政府共同主办，同济大学、中国科学技术战略发展研究院、上海市科学技术委员会和上海张江(集团)有限公司联合承办，致力于创新战略,2009-10-28,浦江创新论坛,002,F127,上海科技报,上海市,上海市泰康路5号200025,地方级,http://www.duob.cn/,,,
32,联想,品牌,危机,后金融危机中国品牌迎来崛起机遇,,2009年，中国经济备受考验，然而2009年，中国经济辉煌依然。党中央、国务院从容应对，全国上下共克时艰，金融危机下的中国自主品牌昂首前行。站在新经济格局的门口，中国品牌有了更多思索的机会和想象的空间。本届论坛的宗旨之一也在于，在对中国企业2009年品牌发展状况进行?,2010-01-19,品牌双周刊,009,F273.2,中国企业报,北京市,北京市海淀区紫竹院南路17号100044,中央级,http://www.zqcn.com.cn/,解艾兰,,
33,联想,品牌,危机,老品牌重来(上),,编者按/北京的冬天寒意浓浓，阔别市场15年的北冰洋汽水却选择在这个时刻回归了，一样的桔子口味，一样的玻璃瓶包装，一样熟悉的大白熊商标，这让很多老北京人期待不已。    而就在此前，北冰洋品牌的托管单位，北京义利食品公司的义利食品专卖店也在北京开业了。除了北?,2011-12-19,营销前沿,C05,F426.82;F274,中国经营报,北京市,北京市海淀区西四环北路6号院1号楼100089,中央级,http://www.cb.com.cn/,,,
34,联想,品牌,危机,联想翻转世界,,10月11日，Gartner发布的数据显示，联想已经成为全球第一大PC厂商，颠覆了全球PC市场的格局；　　　　10月12日，联想在上海发布新品类产品——平板笔记本电脑，以Yoga为典型代表的四款新品颠覆了人们对传统笔记本电脑和平板电脑的传统印象；　　　　联想在智能手机、平板,2012-10-22,特别关注,010,F426.6,中国计算机报,北京市,北京市海淀区紫竹院路66号赛迪大厦18层100044,中央级,http://www.cio360.net/,王沛霖,,
35,联想,品牌,危机,联想整合摩托罗拉  杨元庆下死命令,,2月13日，在联想2013年第三季度财报发布会上，联想董事长兼CEO杨元庆向经济观察报透露，对摩托罗拉移动的整合已经开始了。虽然这项在1月30日达成的交易还处在各个国家相关部门的审查阶段，“但交易一完成，我就要看到它的协同效应。”杨元庆已经向负责移动业务的联想执行副总,2014-02-17,公司,031,F426.6,经济观察报,山东省,山东省济南市趵突泉北路20号250011,地方级,http://www.eeo.com.cn/,张昊,,
36,联想,品牌,危机,联想品牌拆分：定位与团队之忧,,2012年对于联想来讲，不是世界末日，而是突破之年。2012年第四季度，联想出货量超过宿敌——惠普，成功登上全球PC第一的宝座。尽管PC市场份额正在缩水，利润也在下滑，但是“世界已经无法阻止联想迈向全球第一的步伐了”的调侃还是多少有些鼓舞之意。    如果2012年是联想?,2013-01-15,商业·管理,021,F426.6;F273.2,中国企业报,北京市,北京市海淀区紫竹院南路17号100044,中央级,http://www.zqcn.com.cn/,范思绮,,
37,联想,品牌,危机,出版集团多元化样本考察,,企业实行多元化发展的目的很明显——就是追求业务的增长率，追求做大做强的梦想，这是几十年来中国企业追求增长的开始，更是中国企业多元化的拉动力。    10年前，从第一家出版集团诞生时起，集团要不要多元化发展，如何多元化发展的讨论就开始甚嚣尘上。反对者认为，?,2010-05-25,集团产经/出版,002,G239.2-F,中国出版传媒商报,北京市,北京市海淀区西三环北路19号外研大厦北楼100089,中央级,http://www.cbbr.com.cn/,田丽丽,,
38,联想,品牌,危机,25年联想：面孔与表情,,在一系列中国企业崛起的范本中，联想算是最实在的一个，这取决于创始人柳传志的性格。柳传志是一个梦想家，在中国科学院的日子里，他就琢磨着怎么把笔耕不辍的论文变成产品、生成利润；柳传志更是一个现实主义者，在实验室的选择和市场的选择直接冲突时，柳传志毅然选择那些?,2009-08-17,60年杰出成就企业,040,F426.6,经济观察报,山东省,山东省济南市趵突泉北路20号250011,地方级,http://www.eeo.com.cn/,王然,,
39,联想,品牌,危机,自主品牌汽车：历经风雨  难见彩虹,,鼓励政策到期退出、限购政策出台、“合资自主”阻击、产品向高端突围乏力……近来，自主品牌汽车似乎一下陷入了发展瓶颈。现在，在中国这个年产销1800万辆左右的世界第一大市场上，最风光的是合资品牌、进口品牌，最艰难和无奈的是自主品牌。　　2011年至今，自主品牌在整?,2011-10-26,产经新闻·汽车报道,008,F426.471,工人日报,北京市,北京市东城区安德路甲61号100718,中央级,http://www.workercn.cn/,杨冉冉,,
40,联想,品牌,危机,国产手机出路只在拼高端？,,统计数据显示，国产智能手机凭借其低价优势迅速占领了超过七成的市场份额，并已连续数月稳定在这一水平。然而另一方面，国产手机的利润空间却不到10%，量多利薄成为其普遍存在的问题。利润是生存之本。为了能更好地生存下去，国内手机厂商们纷纷开始想办法，试图扭转目前低端,2013-01-02,IT【数码】,C01,F426.6,中国消费者报,北京市,北京市海淀区阜成路北三街8号100037,中央级,http://www.ccn.com.cn/,岳纲举,,
41,联想,品牌,危机,中国品牌建设的“路径变迁”,,对话嘉宾:　　    詹慧川 红星美凯龙家居集团股份有限公司副总裁　　    方 骅 上海家化副总经理　　    陈正辉 王品集团大陆事业群董事主席　　    吕海燕 宜信公司高级副总裁　　    邵永官 九龙仓中国置业有限公司助理董事兼总经理　　    陈 濮 INTERBRAND中,2013-11-25,品牌人物,031,F273.2,21世纪经济报道,广东省,广东省广州市广州大道289号510601,地方级,http://www.21so.com/,罗振宇,,
42,联想,品牌,危机,联想低迷深陷多重流言  中年危机该如何自救？,,日前，联想集团发布消息澄清了业界盛传的其总裁兼首席运营官蒋凡可·兰奇将离职的传闻。财报表现不佳，又在此时传出重要高管将离职的消息，对于艰难转型期的联想可谓“雪上加霜”。未来出路在哪？人工智能市场被认为将是下一个待挖掘的“金矿”，但目前在个人PC业务和移动业?,2017-06-07,厂商,A13,F426.671,通信信息报,福建省,福建省福州东街7号350001,地方级,http://www.txxxb.com/,林憬辉,,
