347,联想,品牌,危机,华为手机单月销量首破千万  高端市场凸显品牌短板,,华为消费者业务BG手机产品线总裁何近日宣布，华为智能手机全球5月份的出货量超过千万台，这也是华为手机首次实现单月销量破千万台。此前，华为终端董事长余承东曾透露，2015年华为将智能手机出货量目标提升至1亿部。单月手机出货量超千万，对于今年全年发货超过1亿台的目标是,2015-06-17,玩转终端,B07,F426.63,通信信息报,福建省,福建省福州东街7号350001,地方级,,陈韵婷,,
348,联想,品牌,危机,寻找下一个十亿消费者,"中国市场成为了世界各大品牌的“必争之地”,面对“狼来了”的国外强敌,中国企业如何在本土市场打出漂亮的攻坚战非常值得期待。",嘉宾：      刘宗信 长安福特马自达汽车有限公司销售分公司副总经理      胡诚初 利郎集团执行董事、副总裁      于春茂 中信银行股份有限公司市场营销部副总经理      李 莉 星河湾集团上海公司营销总监      陈富国 METATHINK咨询集团CEO       蒋青云 复旦大?,2012-12-03,品牌论坛,T05,F273.2,21世纪经济报道,广东省,广东省广州市广州大道289号510601,地方级,,吴伯凡,,
349,联想,品牌,危机,中国手机厂商进军全球市场  直面品牌渠道考验,,国产手机一直以来都有难以割舍的“出海”情结。继十年前首轮出海折戟沉沙之后，国内厂商近日开启了第二次出海潮。联想表示该公司在东南亚市场的出货量已经增长了4倍，在东欧市场甚至增长了6倍；而华为也表示，今年上半年他们的智能手机在中东和非洲市场增长了6倍，在拉丁美洲,2014-10-08,玩转终端,B07,F426.63,通信信息报,福建省,福建省福州东街7号350001,地方级,,邢婷婷,,
350,联想,品牌,危机,来自英伦的感悟,——我市部分单位或部门新闻发言人赴英培训学习体会,编者按 新闻发布制度是党委、政府推进党务、政务公开，进行政策阐释和施政号召的重要载体。我市在2003年和2011年分别组建了政府和党委新闻发言人队伍，并在实际工作中发挥着越来越显著的作用。 　　    为进一步提升我市新闻发言人整体素质，借鉴国外新闻发布制度的先进经?,2012-01-16,专版,010,D630,青岛日报,山东省,山东省青岛市太平路33号266001,地方级,,,,
351,联想,品牌,危机,联想之痛,——9700万亏损后的思与变,“全球第四大PC制造商联想集团日前宣布，其创始人柳传志重新担任公司董事局主席，以应对当前业绩大幅下滑的形势至此，已退居二线多年，专心做资本运营的传奇人物再次成为新闻焦点    1柳传志出山:联想现状不容乐观    根据计划，联想集团创始人兼董事柳传志将?,2009-02-16,新闻观察,A01,F426.6,中国信息化周报,北京市,北京市海淀区紫竹院路66号赛迪大厦16层100044,中央级,,朱梁,,
352,联想,品牌,危机,联想国际中国区遭遇员工流失,联想方面人士称公司会不断引进人才,联想终于成功收购了IBMPC部门。不过，后者大中华区业务团队却正经历着人才流失的危机。    大量员工先后离职    据某媒体报道，联想宣布成功收购IBM PC部门后，IBM PC大中华业务团队已由最初的120多人减员至目前的70～8,2005-05-18,公司·产业,C01,BHS,第一财经日报,上海市,上海市康定路211号艺海大厦14楼200041,地方级,,王如晨,,
353,联想,品牌,危机,自主品牌建设是“质变”的关键,,主要观点　　　　自主品牌的匮乏，造成我国企业主要以贴牌生产和加盟发展的方式在全球产业链的低端与对手竞争，赚取微薄的加工费，付出巨额的加盟费。　　　　中央经济工作会议再次强调，要更加注重提高经济增长质量和效益。在经济全球化深入发展的国际大背景下，进一步?,2010-01-18,市政协五届六次会议特别报道,003,F273.2,绵阳日报,四川省,四川省绵阳市建设街8号621000,地方级,,祝合良,,
354,联想,品牌,危机,“姚之队”如何才能使姚明品牌保值增值？,,姚明已经不再是一个纯粹的篮球运动员了，他已经成了一个品牌符号，一个有着显著特色的精神标志。而以姚明经纪人身份出现的“姚之队”，也随之化身成了姚明个人品牌的专业管理者。　　近来，“姚之队”感觉到肩头的压力越来越大了?,2006-06-21,研究苑,B03,BHC,中国工业报,北京市,北京市西城区展览路葡萄园1号100037,中央级,,孙吐芳,,
355,联想,品牌,危机,中国民航快递加速向国际品牌进军,,在经济全球化的今天，市场经济在某种意义上讲是“品牌经济”，世界级公司和世界级品牌的数量已在某种程度上成为决定一个国家经济强弱的重要指标。当今世界已是品牌世界，品牌无处不在，影响着经济发展的方向、速度、规模和质量。可以说，二十一世纪是品牌竞争的时代。,2006-09-14,,001,BHU,现代物流报,河北省,河北省石家庄市中华北大街3号050000,地方级,,韩相谦,,
356,联想,品牌,危机,品牌穿越周期,,近一两年来，当越来越多中小企业试图运用品牌战略提升竞争力，并努力在国际市场上崭露头角时，国内外一批又一批的著名品牌却频频爆发危机。国内的蒙牛、伊利、达芬奇等品牌无一幸免，国际品牌诸如立顿、雀巢、吉百利等也遭遇了空前危机。　　    这一系列的危机为所有企业?,2012-12-03,品牌论坛,T01,F273.2,21世纪经济报道,广东省,广东省广州市广州大道289号510601,地方级,,黄锴,,
357,联想,品牌,危机,谁的品牌最值钱？,’2000中国品牌价值报告,强势品牌竞争加剧    ’2000品牌评价对象，出现在报告中的是32个，比上年增加2个。今年是评价对象进出最多的一年，出去5个，进来7个。这客观反映出品牌竞争之激烈和品牌变动之激烈。同时，’2000品牌评价也是新增行业较多的一年，32个品牌分,2000-12-13,市场调查,006,BHC,中国信息报,北京市,北京市西城区月坛南街57号100826,中央级,,,,
358,联想,品牌,危机,培育自主品牌要下更大决心,,$T最近，清华美院教授对“陶瓷大国安于为人打工”的质疑和担忧，引起较大反响。现在看起来，培育发展自主品牌，不是我们没有能力，也不只是企业的事，更不能慢慢来。它需要全社会的重视和支持，需要有关方面下更大决心，采取更有效的措施，尽快实现重要突破。$E,2005-03-28,理论周刊,009,BHC,经济日报,北京市,北京市西城区白纸坊东街2号100054,中央级,,阎卡林,,
359,联想,品牌,危机,品牌传播误入“歧途”,,酒类行业特别是白酒总是成为社会大众及舆论众矢之的，其中似有偏颇不公之处。如在公众心目中，往往习惯性地将高端白酒与铺张浪费、腐败奢靡联系到一起，将酒类产品、酒类品牌与酒后驾车、酒后滋事等不文明行为联系到一起。　　　　这便令众多酒业人士忿忿不平，认为此实属?,2013-03-12,主打,A11,F426.82,华夏酒报,山东省,山东省烟台市北大街54号264001,地方级,,石磊,,
360,联想,品牌,危机,危机是否带来跨国并购潮,,【编者按】10月18日，号称全球最大玩具代工厂的东莞合俊两家工厂倒闭，20日，东莞市玩具协会副会长王志光悲观地表示，估计再过两年，东莞45%左右的玩具厂都要倒闭了。这时候，没有人再说，实体经济不会受到金融危机的影响，也没有人再说，中国企业不会受到影响。在,2008-10-29,上证商学院,B07,F279.21,上海证券报,上海市,上海市杨高南路1100号200127,地方级,,本报记者  王颖,,
361,联想,品牌,危机,品牌崛起是国家崛起标志,,汇丰银行的成长与日不落帝国的全球扩张如影随形，宝马的流行预示着德国工业的全面振兴，索尼的大行其道开启了日本制造文化在全球的蔓延，而三星的腾飞标志着韩国新兴市场的崛起……　　    一个国家所拥有的品牌是否流行，可以反映出这个国家的国力是否强盛。也就是说，品?,2009-09-29,中国经济百年论坛,006,F273.2,湖北日报,湖北省,湖北省武汉市武昌黄鹂路65号430077,地方级,,方珞,,
362,联想,品牌,危机,危机带来机遇 挑战促进发展,中国企业走向世界商标战略经验交流会在津召开,为使我国企业在当前国际金融危机形势下，采取积极有效的应对措施，正确实施商标战略，在国际r市场上取得更大发展，经国家工商行政管理总局批准，中华商标协会主办，天津市工商行政管理局协办的中国企业走向世界商标战略经验交流会于8月23日在天津皇冠假酒店举行，来自全国各?,2009-08-28,天津·品牌,008,F203,天津日报,天津市,天津市河西区大沽南路873号300211,地方级,,,,
363,联想,品牌,危机,民族品牌为何频遭无妄之灾,,虽然此前有王老吉凉茶添加门的前车之鉴，然而，民族品牌似乎依旧面临着诸多“信誉”危机。就像全球闷热的天气一样，最近吸引眼球的还有关乎人们日常生活的化妆洗涤用品，国内两大民族品牌遭遇信誉危机。　　　　7月14日，据香港媒体报道，成龙代言的“霸王”品牌旗下的中草,2010-08-03,企业法制,003,F426.82;F273.2,中国企业报,北京市,北京市海淀区紫竹院南路17号100044,中央级,,刘凌林,,
364,联想,品牌,危机,站在未来看重塑,,2009中国服装论坛所提出的“重塑危机后的中国服装品牌”这一新主题，从某种程度上反映了时下中国服装品牌的迫切需要。    习惯经济高速增长环境下成长的中国服装企业，在经济增长放缓、消费心态和消费结构发生变化阶段，迫切需要对过去品牌发展的方向进行再认识，寻找?,2009-03-27,CHIC专刊,A14,F426.86,中国服饰报,北京市,北京市西城区白纸坊东街2号100073,中央级,,王军,王庆坤,
365,联想,品牌,危机,忘掉广告吧，我们已经进入公关营销时代,,$T广告的强迫性不仅令信息传播成本日渐上升，同时也令传播效果不断下降。而公关则凭藉对消费者心理需求的洞幽察微以及传播方式的精准巧妙，顺利地完成了许多广告无法实现的目标。$E    在过去了的20世纪中，广告的威力在市场营销中几乎整整影响了,2005-05-13,生意场·新营销,T00,BHC,民营经济报,广东省,广东省广州市东风东路733号之一510085,地方级,,林景新,,
366,联想,品牌,危机,跨国并购  中国企业唱响国际资本大戏,,2004年12月8日，联想用12.5亿美元购入IBM的PC业务；    2005年底，海尔正式实施全球化战略；    2007年，百度正式宣布“走出去”，并将日本作为国际化战略第一站；    2009年12月26日，顺德日新宣布收购智利一座储量高达30亿吨的铁矿；    2010年3月28日，吉利汽车与,2012-01-12,,A01,F279.2,企业家日报,四川省,四川省成都市二环路西二段12号610072,地方级,,三木,,
367,联想,品牌,危机,联想的新商机,,PC+时代，传统PC硬件产品利润微薄，如何开拓市场，寻找新的利润增长点成为传统PC厂商不能不直视的问题。对于联想而言，拓展企业级产品业务，提升产品的服务性能，转型硬件+软件+服务的全业务竞争模式或能拓展新的市场机会，甚至开拓出新的商业合作模式。　　  据联想集团20,2013-12-16,专题,024,F426.6,华夏时报,北京市,北京市朝阳区建国路93号万达广场西区C座8号楼10层100020,中央级,,薛楠,,
368,联想,品牌,危机,从宏碁看联想的大企业病,,【记者张艳蕊北京报道】有人说联想也得了大企业病，说这话的人是联想的现任总裁杨元庆。    大企业病成了联想的内部危机    虽然外界可能认为联想现在遇到的问题可能是全球IT环境下的增速下滑，但其实这是联想身上的“病毒?,2002-02-05,,001,BHS,中国企业报,北京市,北京市海淀区紫竹院南路17号100044,中央级,,张艳蕊,,
369,联想,品牌,危机,联想回归,,联想集团（0992.HK）昨日宣布，公司创始人柳传志重新担任公司董事局主席，原董事局主席杨元庆担任首席执行官。　　　　公司公布的财报显示，去年第四季度联想集团除税前亏损（不包括重组费用）9000万美元。这已经是联想连续两个季度出现业绩下滑，受此影响，联想集团股票2?,2009-02-06,特别报道,B03,F832.51,中国证券报,北京市,北京市西城区宣武门西大街甲97号100031,中央级,,,,
370,联想,品牌,危机,商业公关化解刘翔退赛危机,,赛前：天价投入押宝“翔飞人”刘翔在2004年雅典奥运会上历史性地获得男子110米栏冠军后，广告商蜂拥而至。一时间刘翔成了广告界的“宠儿”，他的广告在各种媒体上以波涛汹涌之势席卷而来。4年来，各种广告代言不仅让刘翔成为名人更给他带来天价收入且身价倍增。?,2008-08-28,方舟,003,F713.8,中国财经报,北京市,北京丰台区广安路甲54号100073,中央级,,本报实习记者  周婧,,
371,联想,品牌,危机,从核心价值缺失到强势品牌确立,探究国产手机品牌建设之路,1998年以前，中国手机市场被摩托罗拉、爱立信和诺基亚三大海外手机巨头所垄断。作为最早进入中国手机市场的外资品牌，摩托罗拉的单品牌市场份额曾经一度高达80%以上。所以，我们不妨称这一时期为无品牌(NBM：No-brand Manufacture)竞争时期。此时的国内厂商主要为跨国品牌贴?,2005-05-17,,023,BHW,中国电子报,北京市,北京市海淀区紫竹院路66号赛迪大厦8层100044,中央级,,朱岗旗,,
372,联想,品牌,危机,服装品牌开打减店增效之战,,编者按/与运动品牌的境况相类似，传统服装品牌乃至快时尚品牌目前也开始放缓开店的速度。据悉，目前七匹狼已经关闭了80~90家业绩不佳的蓝标及童装店铺，而新增店铺只有5家。服装品牌商纷纷表示，未来将审慎地按市场情况调节开店节奏，以降低在不稳定的经济情况下店铺扩张所带,2013-05-13,服装服饰,E07,F426.86,中国经营报,北京市,北京市海淀区西四环北路6号院1号楼100089,中央级,,索寒雪,,
373,联想,品牌,危机,联想开启光墨打印时代,,经过20年的市场磨练，联想打印机市场占有率已稳居中国第二位。未来，联想打印将发力光墨产品线，抓住微笑曲线“设计”和“营销”两端，实现厂商和消费者价值最大化。　　5月5日，联想打印在北京召开了以“为你，为未来”为主题的2011联想打印策略暨新品发布会。恰逢联想打?,2011-05-09,热点透析,016,F426.671,计算机世界,北京市,北京市海淀区万寿路翠微中里16号3号楼三层100036,中央级,,黄智军,,
374,联想,品牌,危机,大幅整合旨在明确战略意图  联想欲借国内市场渡危机,,"联想今年海外销售任务非常艰巨,原因是国外很多大客户减少了换机需求，但国内市场受益于政府出台的“家电下乡”等扶持措施，因此，联想目前把工作重点转向国内实属必然　　　　日前，联想集团董事会主席柳传志给公司全体员工发了一封信。在信中，他说明了联想目前遭遇困境的",2009-03-25,硬件公司,B12,F426.6,通信信息报,福建省,福建省福州东街7号350001,地方级,,陈晓晟,,
375,联想,品牌,危机,如何成功打造强势品牌？,——著名品牌战略专家余明阳莅并指点迷津,10月27日，我国著名品牌战略专家、上海交通大学管理学院博士生导师，被誉为“中国营销策划少帅”、“中国十大策划人”等称谓的余明阳教授莅并，做客“三晋高管论坛”，作了题为《强势品牌的三大基础》的演讲，为我市众多企业家指点迷津。市政协副主席、市工商联主席陈远新参?,2011-10-28,都市新闻,003,F273.2,太原日报,山西省,山西省太原市新建路78号030002,地方级,,李静,,
376,联想,品牌,危机,国际经济不景气  联想能否逆势而起？,,世界最大电脑制造商之一联想近日公布了第二季度财报。根据财报显示，由于得益于其在欧洲和非洲良好的业绩表现，该公司第二季度销售额为42亿美元，利润增长了65%，净利润为1.105亿美元，每股盈利1.15美元。可以说，经过一两年的盘整与革新，联想已走出并购美国IBM P,2008-08-13,硬件公司,B13,F426.6,通信信息报,福建省,福建省福州东街7号350001,地方级,,吴勇毅,,
377,联想,品牌,危机,中国企业的交接班危机,,现年64岁的招商银行董事长马蔚华突然“被退休”。　　  现年65岁的上海家化董事长葛文耀被免职。　　  现年49岁的马云宣布辞去阿里巴巴CEO一职。　　  改革开放三十多年，随着第一代创办人的老去，中国企业已经到了接班拐点，有些是主动让贤，有些则被动去职，还有更多,2013-05-16,专栏,018,F279.2,华夏时报,北京市,北京市朝阳区建国路93号万达广场西区C座8号楼10层100020,中央级,,李光斗,,
378,联想,品牌,危机,品牌价值建设与品牌价值管理,,品牌价值的意义    何谓“品牌价值”？所谓的“品牌”只不过是个名称而已，一件商品、一系列商品、一个企业的名称而已，犹如每个人都有一个名字，当这个名字没有与一个活生生的人联系起来时，名字的本身是毫无意义的。一件商品、一系列商品、一个企业的名称如果赋予了消费?,2004-02-26,,,BHC,中国企业报,北京市,北京市海淀区紫竹院南路17号100044,中央级,,王先兵,,
379,联想,品牌,危机,吴敬琏详解美国金融危机,,11日，中国经济50人论坛湖北研讨会在湖北日报举办。著名经济学家吴敬琏先后三次接受了《产经周刊》记者专访。他对美国金融危机进行了详尽解读。　　    应对世界金融危机，2009年是打硬仗的一年　　    现在全国各地都在努力对付全球金融危机的影响，估计2009年是要打硬?,2009-01-20,产经周刊,009,F831.59,湖北日报,湖北省,湖北省武汉市武昌黄鹂路65号430077,地方级,,吴敬琏,,
380,联想,品牌,危机,“黄金时代”里的危机与应对,——2004～2005全国IT区域分销商状况报告,大分销似乎在IT渠道扁平化的浪潮中首先受到了冲击，而自2003年以来，区域分销却迅速崛起，许多厂商对区域市场的争夺，甚至使一些区域分销商感受到了“黄金时代”的到来。　　然而，部分以区域分销为主体渠道架构的国内厂商进一步向渠道终端的渗透，以及一些全国性分销商?,2005/05/09,,D08,BHS,中国计算机报,北京市,北京市海淀区紫竹院路66号赛迪大厦18层100044,中央级,,,,
381,联想,品牌,危机,中国企业艰难探路国际化,,12月8日，对于中国、对于世界都是一个值得记住的日子。这一天，中国联想以17.5亿美元并购美国IBM公司PC业务。消息甫出，举世哗然。蛇吞象的故事在中国经济列车疾速前进的21世纪初上演神话新版。跨国并购本是寻常话题，但一家发展中国家的公司收购世界著名企业巨头IBM的PC业,2004/12/21,,,BHS,中国工业报,北京市,北京市西城区展览路葡萄园1号100037,中央级,,贾存斗,,
382,联想,品牌,危机,联想“断臂”  国产手机命运无解,,联想的退出或将成为国产品牌撤出手机市场、剥离手机业务的导火索。强势国产手机厂商的黯然撤离，折射出行业危局正日益加剧。联想之后，下一个国产手机“龙头老大”是谁，何时现身，能否带头破解国产手机的困境目前还是一个无解命题。２００８年开春，中国手机市场?,2008-02-25,通信,D03,F426.6,中国高新技术产业导报,北京市,北京市海淀区木樨地茂林居18号5层100043,中央级,,张伟,,
383,联想,品牌,危机,没想到的联想,,如果你看懂了联想，你就看懂了中国IT企业。如果你了解联想的过去，就一定理解联想的今天。生于忧患，死于安乐。联想的忧患意识使她日渐成熟。今天的业绩表明，联想还是一个好公司，她依然强大，依然生气勃勃。从“没想到”到“想得到”，从“想得到”到“做得到”，联想还有?,2004/08/16,,A10,BHS,中国计算机报,北京市,北京市海淀区紫竹院路66号赛迪大厦18层100044,中央级,,王政,覃特,
384,联想,品牌,危机,服装企业向他们学什么？,,$T11月5－6日，由经济日报社主办的“2005中国自主创新·品牌高层论坛暨中国品牌经济城市峰会”在京举行。以“自主创新”为主题的本次论坛得到了方方面面的高度关注，中共中央政治局常委李长春对论坛作了批示，中共中央政治局委员、书记处书,2005/11/18,专题,A07,BHC,中国服饰报,北京市,北京市西城区白纸坊东街2号100073,中央级,,同黎娜,,
385,联想,品牌,危机,联想Idea的救赎,,编者按：联想消费品牌Idea的是非成败与联想未来命运早已息息相关，昔日联想老将刘军与陈绍鹏将与杨元庆一起扛起联想复兴的重任，新组合的管理团队准备好了吗？　　　　这是一场明显迟到的嘉年华盛会，几经思量后，联想(00992.HK)全球消费产品Idea品牌策略在4月2日午后倾盘?,2009-04-06,解码公司·IT圈,C12,F426.6,中国经营报,北京市,北京市海淀区西四环北路6号院1号楼100089,中央级,,丁飞洋,,
386,联想,品牌,危机,大产业为何难觅大品牌,——林业品牌建设系列报道之二,2009年，我国林业产业总产值预计达到1.58万亿元。作为一项传统而又充满朝气的产业，林业产业涵盖范围广、产业链条长、产品种类多，然而，大行业之中真正能够在社会上叫得响的林业大品牌却是寥寥无几。　　       虽然我国已经成为林业产业大国，但还不是林业产业强国，产业,2010-02-11,市场观察,B02,F326.2,中国绿色时报,北京市,北京市东城区和平里东街18号100714,中央级,,刘琴,,
387,联想,品牌,危机,笔记本电脑凯歌下的重重危机？,,2003年上半年，笔记本电脑市场风云变幻。迅弛发布，降价不断，新厂家纷纷踏入，TCL借道进入笔记本市场，长城转让PC之后挥师笔记本，联想细分消费笔记本电脑市场，厦新和AMD的合作，等等不一而足；而最新数据表明，5月份美国笔记本电脑的销量首次超过了PC。 几乎所有的厂家?,2003/08/18,,F08,BHS,计算机世界,北京市,北京市海淀区万寿路翠微中里16号3号楼三层100036,中央级,,杨霞清,,
388,联想,品牌,危机,支援百安居——空间论解救B＆Q中国之困,,空间论:最精密企业战略导航技术    空间论是什么?    对历史、政治、军事、营销的潜心研究之后，我们发现，化腐朽为神奇，变不可能为可能，以小胜大、以弱胜强、强者通吃，制胜的关键在于对“空间律”的参透:诸葛亮三分天下，毛泽东农村包围城市，邓小平的一国两,2009-08-13,营销,007,F721,中国食品报,北京市,北京市丰台区太平桥东里5号楼100073,中央级,,北京CBCT李志起品牌营销机构,,
389,联想,品牌,危机,聚首房企品牌化时代,,2009年9月8日，由北京名牌评估事务所、中国房地产报联合主办的“2009中国房地产品牌价值峰会”及“2009年中国房地产品牌价值排行榜”颁奖典礼，在北京喜来登长城饭店隆重举行。　　    本届峰会以“创新改变命运，品牌决定成败”为主题，针对经过新一轮的金融危机洗礼后，?,2009-09-14,中国房地产品牌价值排行榜,015,F293.3;F273.2,中国房地产报,北京市,北京市石景山区六合园甲10号100040,中央级,,兰亚红,,
390,联想,品牌,危机,中国家用PC十五年,,$T这是一个崛起的时代：国家崛起、民族崛起……对于中国家用PC来说，更是一个品牌崛起的时代。　　当我们回过头去，把目光落在上世纪的1992年，会发现中国家用PC已经走过了整整15年的崛起之路。在这条路上，涌现出了联想、方正、长城、海尔等一大批中国品牌?,2007-12-17,特别报道,A05,F426.671,电脑报,重庆市,重庆市渝中区双钢路3号科协大厦400013,地方级,,朱文利,丁宁,
391,联想,品牌,危机,对哈药品牌之旅的思考,,$T从提高品牌知名度的角度来考察，哈药的所作所为不仅无可厚非，而且运用得炉火纯青。就哈药在新产品上市之初，以简单的诉求、惟一的功能强调和高强度密集的广告投放方式，快速提高产品及品牌知名度的推广技巧而言，值得那些目前突破无门的企业学习和借?,2004-06-28,营销,003,BHC,医药经济报,广东省,广东省广州市东风东路753号天誉商务大厦西塔6楼510080,地方级,,夏雨平,,
